{
  "metrics": {
    "efficiency": 0.7935,
    "hit_rate_at_10": 0.99,
    "mrr": 0.529558,
    "mttc": 3.065,
    "recommended_technical_score": 0.812567
  },
  "record_id": "phase9",
  "sample_count": 200,
  "schema_version": 1,
  "source_document": "docs/phase9_results.json",
  "system": "phase9-bounded-profile-residual-v1"
}
